{
  "$schema": "https://json-schema.org/draft/2020-12/schema",
  "$id": "urn:coach:schema:derived-metric-value:1",
  "title": "DerivedMetricValue",
  "description": "Append-only value of an application metric with its method version and input snapshot (FR-MET-004). Version 1.3.0 (P10): the dimension may be a muscle group. Version 1.2.0 (P9): the dimension may be a stroke type. Version 1.1.0: optional subject dimension; an aggregation lists one input per known contribution and names its unknown ones; NOT_APPLICABLE retires a value whose metric no longer applies. Owner spec: spec/functional/metrics.spec.md section 4.",
  "type": "object",
  "required": [
    "schemaVersion",
    "valueId",
    "athleteId",
    "metricId",
    "calculationVersion",
    "subject",
    "status",
    "value",
    "unit",
    "inputs",
    "missingInputs",
    "inputConfidence",
    "uncertaintyReasons",
    "computedAt",
    "supersededBy"
  ],
  "additionalProperties": false,
  "properties": {
    "schemaVersion": { "$ref": "urn:coach:schema:common:1#/$defs/schemaVersion" },
    "valueId": { "$ref": "urn:coach:schema:common:1#/$defs/id" },
    "athleteId": { "$ref": "urn:coach:schema:common:1#/$defs/id" },
    "metricId": { "$ref": "urn:coach:schema:common:1#/$defs/metricId" },
    "calculationVersion": { "type": "string", "pattern": "^[0-9]+\\.[0-9]+\\.[0-9]+$" },
    "subject": { "$ref": "#/$defs/subject" },
    "status": { "enum": ["COMPUTED", "MISSING_INPUT", "BELOW_MINIMUM_QUALITY", "NOT_APPLICABLE"] },
    "value": { "type": ["number", "null"] },
    "unit": { "type": "string", "minLength": 1, "maxLength": 20 },
    "inputs": { "type": "array", "items": { "$ref": "#/$defs/input" } },
    "missingInputs": {
      "type": "array",
      "uniqueItems": true,
      "items": { "$ref": "#/$defs/inputName" }
    },
    "inputConfidence": {
      "oneOf": [{ "$ref": "urn:coach:schema:common:1#/$defs/confidence" }, { "type": "null" }]
    },
    "uncertaintyReasons": {
      "type": "array",
      "uniqueItems": true,
      "items": { "$ref": "urn:coach:schema:common:1#/$defs/uncertaintyReason" }
    },
    "computedAt": { "$ref": "urn:coach:schema:common:1#/$defs/utcInstant" },
    "supersededBy": {
      "oneOf": [{ "$ref": "urn:coach:schema:common:1#/$defs/id" }, { "type": "null" }]
    },
    "missingContributions": {
      "description": "Added in 1.1.0: the evidence of an aggregation's unknown contributions.",
      "type": "array",
      "minItems": 1,
      "items": { "$ref": "urn:coach:schema:common:1#/$defs/evidenceRef" }
    }
  },
  "allOf": [
    {
      "if": { "properties": { "status": { "const": "COMPUTED" } } },
      "then": {
        "properties": {
          "value": { "type": "number" },
          "missingInputs": { "maxItems": 0 },
          "inputConfidence": { "$ref": "urn:coach:schema:common:1#/$defs/confidence" }
        }
      }
    },
    {
      "if": { "properties": { "status": { "const": "MISSING_INPUT" } } },
      "then": {
        "properties": {
          "value": { "type": "null" },
          "missingInputs": { "minItems": 1 },
          "uncertaintyReasons": { "contains": { "const": "MISSING_DATA" } }
        }
      }
    },
    {
      "if": { "properties": { "status": { "const": "BELOW_MINIMUM_QUALITY" } } },
      "then": {
        "properties": {
          "value": { "type": "null" },
          "missingInputs": { "maxItems": 0 },
          "inputConfidence": { "$ref": "urn:coach:schema:common:1#/$defs/confidence" }
        }
      }
    },
    {
      "if": { "properties": { "status": { "const": "NOT_APPLICABLE" } } },
      "then": {
        "properties": {
          "value": { "type": "null" },
          "inputs": { "maxItems": 0 },
          "missingInputs": { "maxItems": 0 },
          "inputConfidence": { "type": "null" },
          "uncertaintyReasons": { "maxItems": 0 }
        }
      }
    },
    {
      "if": { "required": ["missingContributions"] },
      "then": { "properties": { "status": { "const": "MISSING_INPUT" } } }
    }
  ],
  "$defs": {
    "inputName": { "type": "string", "pattern": "^[a-z][a-z0-9_]*$", "maxLength": 64 },
    "input": {
      "type": "object",
      "required": ["name", "value", "evidence", "confidence"],
      "additionalProperties": false,
      "properties": {
        "name": { "$ref": "#/$defs/inputName" },
        "value": { "type": "number" },
        "evidence": { "$ref": "urn:coach:schema:common:1#/$defs/evidenceRef" },
        "confidence": { "$ref": "urn:coach:schema:common:1#/$defs/confidence" }
      }
    },
    "subject": {
      "type": "object",
      "required": ["kind", "key"],
      "additionalProperties": false,
      "properties": {
        "kind": { "enum": ["ACTIVITY", "DAY", "WEEK", "EXERCISE"] },
        "key": { "type": "string", "maxLength": 64 },
        "dimension": {
          "description": "Added in 1.1.0 (metrics spec section 4): a sport code for per-sport values, Z1 to Z10 for zones; from 1.2.0 a stroke type, from 1.3.0 a muscle group.",
          "type": "string",
          "pattern": "^(Z([1-9]|10)|RUNNING|CYCLING|SWIMMING|STRENGTH|TENNIS|OTHER|FREESTYLE|BACKSTROKE|BREASTSTROKE|BUTTERFLY|QUADRICEPS|HAMSTRINGS|GLUTES|CALVES|SOLEUS|ADDUCTORS|ABDUCTORS|FOOT_ANKLE|CORE|ERECTOR_SPINAE|LATS|RHOMBOIDS|TRAPEZIUS|PECTORALS|DELTOIDS|ROTATOR_CUFF|BICEPS|TRICEPS|FOREARMS)$"
        }
      },
      "allOf": [
        {
          "if": { "properties": { "kind": { "const": "ACTIVITY" } } },
          "then": { "properties": { "key": { "$ref": "urn:coach:schema:common:1#/$defs/id" } } }
        },
        {
          "if": { "properties": { "kind": { "const": "DAY" } } },
          "then": { "properties": { "key": { "$ref": "urn:coach:schema:common:1#/$defs/localDate" } } }
        },
        {
          "if": { "properties": { "kind": { "const": "WEEK" } } },
          "then": { "properties": { "key": { "pattern": "^[0-9]{4}-W(0[1-9]|[1-4][0-9]|5[0-3])$" } } }
        },
        {
          "if": { "properties": { "kind": { "const": "EXERCISE" } } },
          "then": { "properties": { "key": { "pattern": "^ex\\.[a-z0-9_]+$" } } }
        }
      ]
    }
  }
}
